{
  "username": "mockdev",
  "name": "Mock Developer",
  "avatar_url": "https://github.com/identicons/mockdev.png",
  "repos": 42,
  "private_repos": 10,
  "stars": 1337,
  "followers": 256,
  "following": 128,
  "commit_activity": {
    "last_30_days": [5, 8, 3, 12, 7, 4, 9, 15, 6, 11, 8, 5, 13, 9, 7, 10, 12, 8, 6, 14, 11, 9, 7, 15, 10, 8, 12, 9, 7, 11],
    "total_30_days": 267,
    "activity_grid": [
      [0, 0, 0, 0, 0, 0, 0, 1, 2, 3, 4, 5, 6, 5, 4, 3, 2, 1, 0, 0, 0, 0, 0, 0],
      [0, 0, 0, 0, 0, 0, 1, 2, 3, 4, 5, 6, 7, 6, 5, 4, 3, 2, 1, 0, 0, 0, 0, 0],
      [0, 0, 0, 0, 0, 0, 1, 2, 4, 5, 6, 7, 8, 7, 6, 5, 4, 2, 1, 0, 0, 0, 0, 0],
      [0, 0, 0, 0, 0, 0, 1, 3, 5, 6, 7, 8, 9, 8, 7, 6, 5, 3, 1, 0, 0, 0, 0, 0],
      [0, 0, 0, 0, 0, 0, 1, 2, 4, 5, 6, 7, 8, 7, 6, 5, 4, 2, 1, 0, 0, 0, 0, 0],
      [0, 0, 0, 0, 0, 0, 0, 1, 2, 3, 4, 4, 4, 4, 3, 2, 1, 1, 0, 0, 0, 0, 0, 0],
      [0, 0, 0, 0, 0, 0, 0, 0, 1, 2, 2, 2, 2, 2, 2, 1, 1, 0, 0, 0, 0, 0, 0, 0]
    ],
    "days": ["Mon", "Tue", "Wed", "Thu", "Fri", "Sat", "Sun"]
  },
  "prs": {
    "opened": 89,
    "merged": 78
  },
  "issues": {
    "opened": 134
  },
  "languages": {
    "Python": 45.2,
    "JavaScript": 28.7,
    "TypeScript": 15.3,
    "Shell": 6.4,
    "Other": 4.4
  },
  "top_repositories": [
    {"name": "awesome-project", "commits": 234},
    {"name": "cool-library", "commits": 156},
    {"name": "useful-tool", "commits": 98}
  ],
  "updated_at": "2024-12-03T00:00:00Z"
}
